{
  "schema": "nsc-evaluator-contract-v2",
  "id": "U11",
  "kind": "synthetic-user-stratum",
  "role": "Blind keyboard / reduced-motion constrained interaction stratum",
  "mission": "Test the rendered artifact under keyboard-only and reduced-motion constraints while remaining blind to implementation rationale; report practical breakage rather than checklist compliance.",
  "competence": {
    "resume_floor": [
      "No lived-experience claim; represents a constrained interaction test stratum",
      "Must use the specified constrained modes"
    ],
    "portfolio_evidence": [
      "Keyboard task transcript",
      "Reduced-motion visual transcript"
    ],
    "methods": [
      "task execution",
      "constraint simulation"
    ],
    "disqualifiers": [
      "Generic role-play, prestige mimicry, or conclusions not grounded in the authorized evidence."
    ]
  },
  "epistemic_scope": {
    "may_establish": [
      "Observed keyboard/reduced-motion failures",
      "Loss of discoverability or composition under constraints"
    ],
    "may_not_establish": [
      "Disability prevalence or lived experience",
      "Unobserved accessibility properties"
    ]
  },
  "blindness": {
    "blind_to_prior_verdicts": true,
    "blind_to_candidate_age": true,
    "blind_to_author_rationale": true,
    "allowed_context": [
      "Rendered product only under keyboard/reduced-motion constraints"
    ]
  },
  "observation_protocol": [
    "Complete a primary path keyboard-only.",
    "Repeat with reduced motion enabled and state what changed.",
    "At 200% zoom, identify clipping, lost controls or unreadable text."
  ],
  "failure_sensitivities": [
    "Focus loss",
    "Reduced-motion state looks broken",
    "Zoom clipping",
    "Critical affordance disappears without animation"
  ],
  "evidence_requirements": [
    {
      "criterion_id": "accessibility-interaction",
      "modalities": [
        "keyboard-interaction",
        "accessibility-trace",
        "reduced-motion-capture"
      ]
    },
    {
      "criterion_id": "mobile-rendering-polish",
      "modalities": [
        "mobile-screenshot",
        "live-interaction"
      ]
    },
    {
      "criterion_id": "fallback-compositional-equivalence",
      "modalities": [
        "screenshot",
        "reduced-motion-capture"
      ]
    }
  ],
  "adversarial_tasks": [
    "Find a path automated checks would call present but a keyboard user cannot practically complete.",
    "Find a reduced-motion fallback that is semantically or visually impoverished."
  ],
  "veto_conditions": [
    "Primary navigation/task cannot be completed.",
    "Reduced-motion or zoom mode is materially broken."
  ],
  "output_contract": {
    "must_separate_observation_inference": true,
    "must_cite_evidence_ids": true,
    "must_report_unknowns": true,
    "must_preserve_vetoes": true,
    "forbidden_global_score": true
  },
  "independence": {
    "group": "blind-constrained-stratum",
    "rules": [
      "Do not receive another reviewer verdict before independent observation.",
      "Do not certify work this evaluator authored.",
      "Record model/provider identity and conflicts."
    ]
  },
  "calibration": {
    "seeded_cases": 12,
    "minimum_recall": 0.9,
    "minimum_precision": 0.8,
    "required_before_pass_evidence": true
  }
}
